{
  "$schema": "../../appsync-config.schema.json",
  "schema": "./schema.graphql",
  "apiConfig": {
    "auth": [
      {
        "type": "API_KEY",
        "key": "test-api-key"
      }
    ]
  },
  "dataSources": [
    {
      "type": "NONE",
      "name": "NoneDS"
    }
  ],
  "resolvers": [
    {
      "type": "Query",
      "field": "getTask",
      "kind": "Unit",
      "dataSource": "NoneDS",
      "file": "./resolvers/getTask.js"
    },
    {
      "type": "Query",
      "field": "listTasks",
      "kind": "Unit",
      "dataSource": "NoneDS",
      "file": "./resolvers/listTasks.js"
    },
    {
      "type": "Query",
      "field": "getProject",
      "kind": "Unit",
      "dataSource": "NoneDS",
      "file": "./resolvers/getProject.js"
    },
    {
      "type": "Mutation",
      "field": "createTask",
      "kind": "Unit",
      "dataSource": "NoneDS",
      "file": "./resolvers/createTask.js"
    },
    {
      "type": "Task",
      "field": "taskNumber",
      "kind": "Unit",
      "dataSource": "NoneDS",
      "file": "./resolvers/taskNumber.js"
    },
    {
      "type": "Task",
      "field": "displayName",
      "kind": "Unit",
      "dataSource": "NoneDS",
      "file": "./resolvers/displayName.js"
    },
    {
      "type": "Task",
      "field": "priority",
      "kind": "Unit",
      "dataSource": "NoneDS",
      "file": "./resolvers/priority.js"
    },
    {
      "type": "Task",
      "field": "assignee",
      "kind": "Unit",
      "dataSource": "NoneDS",
      "file": "./resolvers/assignee.js"
    },
    {
      "type": "User",
      "field": "displayRole",
      "kind": "Unit",
      "dataSource": "NoneDS",
      "file": "./resolvers/displayRole.js"
    },
    {
      "type": "Project",
      "field": "tasks",
      "kind": "Unit",
      "dataSource": "NoneDS",
      "file": "./resolvers/projectTasks.js"
    }
  ]
}
